{
  "v": 1,
  "issuedAt": "2023-11-14T22:13:20Z",
  "subject": {
    "principal": {
      "id": "u1",
      "roles": ["member"]
    },
    "context": {}
  },
  "roles": ["member"],
  "grants": [
    {
      "permission": "post.read",
      "effect": "allow",
      "role": "member",
      "to": { "kind": "role", "role": "member", "scope": "global" }
    }
  ],
  "tenants": []
}
